{
  "event_id": "01JB7ZC7A8B9C0D1E2F3G4H5J6",
  "at": "2026-10-23T10:15:00.240Z",
  "type": "command_transition",
  "device": "sim.psu-01",
  "capability": "power.output.voltage.setpoint",
  "command_id": "01JB7Z8Q3W4X5Y6Z7A8B9C0D1E",
  "data": { "from": "APPLIED", "to": "VERIFIED" },
  "severity": "info"
}
